# Validated / fixed EDID for builtin panel of Surface Laptop Studio 2
# https://hverkuil.home.xs4all.nl/edid-decode/edid-decode.html

edid-decode (hex):

00 ff ff ff ff ff ff 00 4d 10 87 15 a0 32 08 66
2a 1e 01 04 b5 1e 14 78 07 ee 91 a3 54 4c 99 26
0f 50 54 20 00 00 01 01 01 01 01 01 01 01 01 01
01 01 01 01 01 01 52 c4 60 a0 90 40 24 60 30 20
3a 00 2f ca 10 00 00 18 52 c4 60 a0 90 40 88 66
30 20 3a 00 2f ca 10 00 00 18 00 00 00 fd 00 1e
78 1e c5 33 01 0a 20 20 20 20 20 20 00 00 00 fc
00 4c 51 31 34 34 50 31 4a 58 30 31 0a 20 01 cd

02 03 12 80 e2 00 4a e3 05 80 00 e6 06 05 01 76
76 3e 00 00 00 00 00 00 00 00 00 00 00 00 00 00
00 00 00 00 00 00 00 00 00 00 00 00 00 00 00 00
00 00 00 00 00 00 00 00 00 00 00 00 00 00 00 00
00 00 00 00 00 00 00 00 00 00 00 00 00 00 00 00
00 00 00 00 00 00 00 00 00 00 00 00 00 00 00 00
00 00 00 00 00 00 00 00 00 00 00 00 00 00 00 00
00 00 00 00 00 00 00 00 00 00 00 00 00 00 00 b9

----------------

Block 0, Base EDID:
  EDID Structure Version & Revision: 1.4
  Vendor & Product Identification:
    Manufacturer: SHP
    Model: 5511
    Serial Number: 1711813280 (0x660832a0)
    Made in: week 42 of 2020
  Basic Display Parameters & Features:
    Digital display
    Bits per primary color channel: 10
    DisplayPort interface
    Maximum image size: 30 cm x 20 cm
    Gamma: 2.20
    Supported color formats: RGB 4:4:4
    Default (sRGB) color space is primary color space
    First detailed timing includes the native pixel format and preferred refresh rate
    Display supports continuous frequencies
  Color Characteristics:
    Red  : 0.6396, 0.3300
    Green: 0.2998, 0.5996
    Blue : 0.1503, 0.0595
    White: 0.3125, 0.3291
  Established Timings I & II:
    DMT 0x04:   640x480    59.940476 Hz   4:3     31.469 kHz     25.175000 MHz
  Standard Timings: none
  Detailed Timing Descriptors:
    DTD 1:  2400x1600  120.000191 Hz   3:2    196.320 kHz    502.580000 MHz (303 mm x 202 mm)
                 Hfront   48 Hsync  32 Hback   80 Hpol N
                 Vfront    3 Vsync  10 Vback   23 Vpol N
    DTD 2:  2400x1600   60.000096 Hz   3:2    196.320 kHz    502.580000 MHz (303 mm x 202 mm)
                 Hfront   48 Hsync  32 Hback   80 Hpol N
                 Vfront    3 Vsync  10 Vback 1659 Vpol N
    Display Range Limits:
      Monitor ranges (Range Limits Only): 30-120 Hz V, 30-197 kHz H, max dotclock 510 MHz
    Display Product Name: 'LQ144P1JX01'
  Extension blocks: 1
Checksum: 0xcd

----------------

Block 1, CTA-861 Extension Block:
  Revision: 3
  Underscans IT Video Formats by default
  Native detailed modes: 0
  Video Capability Data Block:
    YCbCr quantization: No Data
    RGB quantization: Selectable (via AVI Q)
    PT scan behavior: No Data
    IT scan behavior: Always Underscanned
    CE scan behavior: Always Underscanned
  Colorimetry Data Block:
    BT2020RGB
  HDR Static Metadata Data Block:
    Electro optical transfer functions:
      Traditional gamma - SDR luminance range
      SMPTE ST2084
    Supported static metadata descriptors:
      Static metadata type 1
    Desired content max luminance: 118 (644.196 cd/m^2)
    Desired content max frame-average luminance: 118 (644.196 cd/m^2)
    Desired content min luminance: 62 (0.381 cd/m^2)
Checksum: 0xb9  Unused space in Extension Block: 109 bytes

----------------

Preferred Video Timing if only Block 0 is parsed:
  DTD   1:  2400x1600  120.000191 Hz   3:2    196.320 kHz    502.580000 MHz (303 mm x 202 mm)
                 Hfront   48 Hsync  32 Hback   80 Hpol N
                 Vfront    3 Vsync  10 Vback   23 Vpol N

----------------

Preferred Video Timing if Block 0 and CTA-861 Blocks are parsed:
  DTD   1:  2400x1600  120.000191 Hz   3:2    196.320 kHz    502.580000 MHz (303 mm x 202 mm)
                 Hfront   48 Hsync  32 Hback   80 Hpol N
                 Vfront    3 Vsync  10 Vback   23 Vpol N

----------------

Native Video Resolution:
  2400x1600

----------------

edid-decode SHA: aec5cf4e302b 2025-10-16 07:00:59

EDID conformity: PASS
